{
  "schema": "cassandra-index-public",
  "schema_version": 1,
  "site": "https://cassindex.ru",
  "license": {
    "name": "CC BY 4.0",
    "url": "https://creativecommons.org/licenses/by/4.0/legalcode",
    "attribution": "Cassandra Index — https://cassindex.ru, лицензия CC BY 4.0",
    "note": "Атрибуция обязательна: при переиспользовании укажите «Cassandra Index, версия, дата недели, https://cassindex.ru» и лицензию CC BY 4.0.",
    "placeholder": false
  },
  "week": {
    "week": "2026-10-25",
    "published": "2026-10-25",
    "through": "2026-10-25",
    "methodology": "3.0",
    "regions_taxonomy": "2.0",
    "data_state": "published",
    "index": 68,
    "delta": 4,
    "state": "very",
    "q": 1,
    "confidence": "full",
    "coverage_criteria": {
      "covered": 37,
      "total": 46
    },
    "regions": [
      {
        "id": "russia-belarus",
        "index": 70,
        "delta": 2,
        "background": false
      },
      {
        "id": "ukraine-moldova",
        "index": 68,
        "delta": 5,
        "background": false
      },
      {
        "id": "baltic",
        "index": 69,
        "delta": 2,
        "background": false
      },
      {
        "id": "balkans",
        "index": 69,
        "delta": 2,
        "background": false
      },
      {
        "id": "eu-north-europe",
        "index": 68,
        "delta": 2,
        "background": false
      },
      {
        "id": "south-caucasus",
        "index": 66,
        "delta": 5,
        "background": false
      },
      {
        "id": "central-asia",
        "index": 65,
        "delta": 2,
        "background": false
      },
      {
        "id": "east-asia",
        "index": 64,
        "delta": -2,
        "background": false
      },
      {
        "id": "middle-east",
        "index": 79,
        "delta": 10,
        "background": false
      },
      {
        "id": "north-america",
        "index": 72,
        "delta": 6,
        "background": false
      },
      {
        "id": "south-asia",
        "index": 68,
        "delta": 2,
        "background": false
      },
      {
        "id": "africa",
        "index": 70,
        "delta": 4,
        "background": false
      }
    ],
    "precursor": {
      "value": 47,
      "signaling_subgroups": 6
    },
    "precursor_present": true,
    "drivers": [
      {
        "label": {
          "ru": "Вашингтон и Тегеран на пороге удара, Ормуз перекрыт",
          "en": "Washington and Tehran on the brink of a strike, Hormuz blocked"
        },
        "contribution": "high"
      },
      {
        "label": {
          "ru": "Йеменская война бьёт по аэропортам и нефти Саудовской Аравии",
          "en": "Yemen's war hits Saudi airports and Saudi oil"
        },
        "contribution": "high"
      },
      {
        "label": {
          "ru": "Олешки: гуманитарное перемирие согласовано, но фронт не стих",
          "en": "Oleshky: a humanitarian ceasefire agreed, but the front has not calmed"
        },
        "contribution": "high"
      }
    ],
    "driver_breakdown": [
      {
        "id": "D1",
        "name": {
          "ru": "Д1. Военная активность",
          "en": "D1. Military activity"
        },
        "score": 0.6,
        "confidence": "high",
        "weight": 0.1175,
        "weight_effective": 0.171,
        "covered": {
          "criteria": 4,
          "total": 6
        },
        "contribution_pp": 15.3,
        "top_criteria": [
          {
            "id": "D1.4",
            "name": {
              "ru": "Актуальные боевые действия",
              "en": "Active hostilities"
            },
            "dir": "esc",
            "value": 1,
            "contribution": 0.25,
            "share": 0.417
          },
          {
            "id": "D1.5",
            "name": {
              "ru": "Развёртывание стратегических систем",
              "en": "Deployment of strategic systems"
            },
            "dir": "esc",
            "value": 0.67,
            "contribution": 0.168,
            "share": 0.279
          },
          {
            "id": "D1.1",
            "name": {
              "ru": "Перемещения войск и военных колонн",
              "en": "Troop and military column movements"
            },
            "dir": "esc",
            "value": 0.4,
            "contribution": 0.1,
            "share": 0.167
          }
        ]
      },
      {
        "id": "D2",
        "name": {
          "ru": "Д2. Ядерная сигнальная активность",
          "en": "D2. Nuclear signaling activity"
        },
        "score": 0.29,
        "confidence": "medium",
        "weight": 0.1175,
        "weight_effective": 0.12,
        "covered": {
          "criteria": 4,
          "total": 5
        },
        "contribution_pp": 5.2,
        "top_criteria": [
          {
            "id": "D2.1",
            "name": {
              "ru": "Публичные ядерные угрозы",
              "en": "Public nuclear threats"
            },
            "dir": "esc",
            "value": 0.67,
            "contribution": 0.223,
            "share": 0.77
          },
          {
            "id": "D2.3",
            "name": {
              "ru": "Технические ядерные сигналы",
              "en": "Technical nuclear signals"
            },
            "dir": "esc",
            "value": 0.2,
            "contribution": 0.067,
            "share": 0.23
          }
        ]
      },
      {
        "id": "D3",
        "name": {
          "ru": "Д3. Дипломатическая эскалация и деэскалация",
          "en": "D3. Diplomatic escalation and de-escalation"
        },
        "score": 0.173,
        "confidence": "medium",
        "weight": 0.1175,
        "weight_effective": 0.12,
        "covered": {
          "criteria": 5,
          "total": 5
        },
        "contribution_pp": 3.1,
        "top_criteria": [
          {
            "id": "D3.2",
            "name": {
              "ru": "Ультиматумы",
              "en": "Ultimatums"
            },
            "dir": "esc",
            "value": 0.67,
            "contribution": 0.223,
            "share": 0.368
          },
          {
            "id": "D3.4",
            "name": {
              "ru": "Переговоры и посредничество",
              "en": "Talks and mediation"
            },
            "dir": "deesc",
            "value": 0.67,
            "contribution": -0.167,
            "share": -0.276
          },
          {
            "id": "D3.3",
            "name": {
              "ru": "Санкции и международно-правовые решения",
              "en": "Sanctions and legal measures"
            },
            "dir": "esc",
            "value": 0.3,
            "contribution": 0.1,
            "share": 0.165
          }
        ]
      },
      {
        "id": "D4",
        "name": {
          "ru": "Д4. Экономические индикаторы конфликта",
          "en": "D4. Economic indicators of conflict"
        },
        "score": 0.4,
        "confidence": "high",
        "weight": 0.1175,
        "weight_effective": 0.171,
        "covered": {
          "criteria": 5,
          "total": 6
        },
        "contribution_pp": 10.3,
        "top_criteria": [
          {
            "id": "D4.6",
            "name": {
              "ru": "Стресс на финансовых и сырьевых рынках",
              "en": "Financial and commodity market stress"
            },
            "dir": "esc",
            "value": 1,
            "contribution": 0.25,
            "share": 0.313
          },
          {
            "id": "D4.5",
            "name": {
              "ru": "Снятие экономических ограничений",
              "en": "Easing of economic restrictions"
            },
            "dir": "deesc",
            "value": 0.4,
            "contribution": -0.2,
            "share": -0.25
          },
          {
            "id": "D4.3",
            "name": {
              "ru": "Разрыв цепочек поставок",
              "en": "Supply chain disruption"
            },
            "dir": "esc",
            "value": 0.67,
            "contribution": 0.168,
            "share": 0.209
          }
        ]
      },
      {
        "id": "D5",
        "name": {
          "ru": "Д5. Информационная и киберсфера",
          "en": "D5. Information and cyber sphere"
        },
        "score": 0.6,
        "confidence": "low",
        "weight": 0.1175,
        "weight_effective": 0.068,
        "covered": {
          "criteria": 2,
          "total": 4
        },
        "contribution_pp": 6.2,
        "top_criteria": [
          {
            "id": "D5.1",
            "name": {
              "ru": "Эскалация военной риторики",
              "en": "Escalation of war rhetoric"
            },
            "dir": "esc",
            "value": 1,
            "contribution": 0.5,
            "share": 0.833
          },
          {
            "id": "D5.2",
            "name": {
              "ru": "Кибероперации",
              "en": "Cyber operations"
            },
            "dir": "esc",
            "value": 0.2,
            "contribution": 0.1,
            "share": 0.167
          }
        ]
      },
      {
        "id": "D6",
        "name": {
          "ru": "Д6. Мобилизация общества",
          "en": "D6. Societal mobilization"
        },
        "score": 0.553,
        "confidence": "medium",
        "weight": 0.1175,
        "weight_effective": 0.12,
        "covered": {
          "criteria": 3,
          "total": 4
        },
        "contribution_pp": 9.9,
        "top_criteria": [
          {
            "id": "D6.3",
            "name": {
              "ru": "Военная переориентация экономики",
              "en": "Military reorientation of the economy"
            },
            "dir": "esc",
            "value": 1,
            "contribution": 0.333,
            "share": 0.602
          },
          {
            "id": "D6.1",
            "name": {
              "ru": "Военное положение и мобилизация",